{
  "$schema": "https://json-schema.org/draft/2020-12/schema",
  "title": "WorkflowRun",
  "description": "Public progress view. The owner is never part of the DTO; it comes from the authenticated principal and is enforced server-side on every read and write.",
  "type": "object",
  "additionalProperties": false,
  "required": [
    "schema_version",
    "run_id",
    "template",
    "state",
    "state_reason",
    "targets",
    "parameters",
    "budgets_used",
    "steps",
    "created_at",
    "updated_at"
  ],
  "properties": {
    "schema_version": {
      "const": "linux-mcp/workflow-run/v1"
    },
    "run_id": {
      "type": "string",
      "pattern": "^[0-9a-f]{8}-[0-9a-f]{4}-[0-9a-f]{4}-[0-9a-f]{4}-[0-9a-f]{12}$"
    },
    "template": {
      "type": "object",
      "additionalProperties": false,
      "required": [
        "id",
        "version",
        "digest"
      ],
      "properties": {
        "id": {
          "type": "string",
          "pattern": "^[a-z][a-z0-9-]{2,63}$"
        },
        "version": {
          "type": "integer",
          "minimum": 1
        },
        "digest": {
          "type": "string",
          "pattern": "^sha256:[0-9a-f]{64}$"
        }
      }
    },
    "state": {
      "type": "string",
      "enum": [
        "created",
        "running",
        "awaiting_approval",
        "unknown_outcome",
        "reconciling",
        "blocked",
        "stopped",
        "completed",
        "completed_partial",
        "failed",
        "cancelled"
      ]
    },
    "state_reason": {
      "type": [
        "string",
        "null"
      ],
      "enum": [
        "authorization_lost",
        "revision_changed",
        "target_disabled",
        "budget_exhausted",
        "stop_condition",
        "approval_expired",
        "approval_rejected",
        "outcome_unknown",
        "step_failed",
        "user_cancelled",
        null
      ]
    },
    "targets": {
      "type": "array",
      "minItems": 1,
      "maxItems": 20,
      "items": {
        "type": "object",
        "additionalProperties": false,
        "required": [
          "server_id",
          "server_revision_at_start"
        ],
        "properties": {
          "server_id": {
            "type": "string",
            "pattern": "^[0-9a-f]{8}-[0-9a-f]{4}-[0-9a-f]{4}-[0-9a-f]{4}-[0-9a-f]{12}$"
          },
          "server_revision_at_start": {
            "type": "integer",
            "minimum": 1
          }
        }
      }
    },
    "parameters": {
      "type": "object",
      "additionalProperties": {
        "type": [
          "string",
          "integer",
          "boolean"
        ]
      }
    },
    "budgets_used": {
      "type": "object",
      "additionalProperties": false,
      "required": [
        "steps",
        "tool_calls",
        "elapsed_s",
        "observation_bytes"
      ],
      "properties": {
        "steps": {
          "type": "integer",
          "minimum": 0
        },
        "tool_calls": {
          "type": "integer",
          "minimum": 0
        },
        "elapsed_s": {
          "type": "integer",
          "minimum": 0
        },
        "observation_bytes": {
          "type": "integer",
          "minimum": 0
        }
      }
    },
    "steps": {
      "type": "array",
      "maxItems": 400,
      "items": {
        "type": "object",
        "additionalProperties": false,
        "required": [
          "step_id",
          "target_server_id",
          "state",
          "started_at",
          "finished_at",
          "observation",
          "operation_id",
          "approval_id",
          "submission",
          "outcome_status",
          "verification",
          "error_code"
        ],
        "properties": {
          "step_id": {
            "type": "string",
            "pattern": "^[a-z][a-z0-9_]{0,31}$"
          },
          "target_server_id": {
            "type": [
              "string",
              "null"
            ],
            "pattern": "^[0-9a-f]{8}-[0-9a-f]{4}-[0-9a-f]{4}-[0-9a-f]{4}-[0-9a-f]{12}$"
          },
          "state": {
            "type": "string",
            "enum": [
              "pending",
              "running",
              "succeeded",
              "failed",
              "skipped",
              "awaiting_approval",
              "approved",
              "dispatching",
              "submitted",
              "unknown",
              "reconciled",
              "verified",
              "verification_mismatch",
              "verification_unavailable",
              "blocked",
              "refused"
            ]
          },
          "started_at": {
            "type": [
              "string",
              "null"
            ],
            "pattern": "^\\d{4}-\\d{2}-\\d{2}T\\d{2}:\\d{2}:\\d{2}\\.\\d{3}Z$"
          },
          "finished_at": {
            "type": [
              "string",
              "null"
            ],
            "pattern": "^\\d{4}-\\d{2}-\\d{2}T\\d{2}:\\d{2}:\\d{2}\\.\\d{3}Z$"
          },
          "observation": {
            "type": [
              "object",
              "null"
            ],
            "additionalProperties": false,
            "properties": {
              "tool": {
                "type": "string"
              },
              "collected_at": {
                "type": "string",
                "pattern": "^\\d{4}-\\d{2}-\\d{2}T\\d{2}:\\d{2}:\\d{2}\\.\\d{3}Z$"
              },
              "truncated": {
                "type": "boolean"
              },
              "bytes": {
                "type": "integer",
                "minimum": 0
              }
            }
          },
          "operation_id": {
            "type": [
              "string",
              "null"
            ],
            "pattern": "^[0-9a-f]{8}-[0-9a-f]{4}-[0-9a-f]{4}-[0-9a-f]{4}-[0-9a-f]{12}$"
          },
          "approval_id": {
            "type": [
              "string",
              "null"
            ],
            "pattern": "^[0-9a-f]{8}-[0-9a-f]{4}-[0-9a-f]{4}-[0-9a-f]{4}-[0-9a-f]{12}$"
          },
          "submission": {
            "type": [
              "string",
              "null"
            ],
            "enum": [
              "not_submitted",
              "submission_pending",
              "submitted",
              "completed",
              null
            ]
          },
          "outcome_status": {
            "type": [
              "string",
              "null"
            ],
            "enum": [
              "succeeded",
              "refused",
              "failed_before_submission",
              "unknown_after_submission",
              null
            ]
          },
          "verification": {
            "type": [
              "string",
              "null"
            ],
            "enum": [
              "verified",
              "mismatch",
              "unavailable",
              "not_attempted",
              null
            ]
          },
          "error_code": {
            "type": [
              "string",
              "null"
            ],
            "enum": [
              "unauthenticated",
              "forbidden",
              "not_found",
              "validation",
              "revision_conflict",
              "approval_required",
              "unavailable",
              "timeout",
              "outcome_unknown",
              null
            ]
          }
        }
      }
    },
    "created_at": {
      "type": "string",
      "pattern": "^\\d{4}-\\d{2}-\\d{2}T\\d{2}:\\d{2}:\\d{2}\\.\\d{3}Z$"
    },
    "updated_at": {
      "type": "string",
      "pattern": "^\\d{4}-\\d{2}-\\d{2}T\\d{2}:\\d{2}:\\d{2}\\.\\d{3}Z$"
    }
  }
}
