{
  "schema_version": "linux-mcp/workflow-run/v1",
  "run_id": "b1000000-0000-4000-8000-000000000001",
  "template": {
    "id": "restart-service",
    "version": 1,
    "digest": "sha256:abababababababababababababababababababababababababababababababab"
  },
  "state": "blocked",
  "state_reason": "revision_changed",
  "targets": [
    {
      "server_id": "5e000000-0000-4000-8000-00000000a001",
      "server_revision_at_start": 2
    }
  ],
  "parameters": {
    "service": "nginx.service"
  },
  "budgets_used": {
    "steps": 1,
    "tool_calls": 1,
    "elapsed_s": 12,
    "observation_bytes": 412
  },
  "steps": [
    {
      "step_id": "before",
      "target_server_id": "5e000000-0000-4000-8000-00000000a001",
      "state": "succeeded",
      "started_at": "2026-10-11T09:00:00.000Z",
      "finished_at": "2026-10-11T09:00:05.000Z",
      "observation": {
        "tool": "get_service",
        "collected_at": "2026-10-11T09:00:00.000Z",
        "truncated": false,
        "bytes": 412
      },
      "operation_id": null,
      "approval_id": null,
      "submission": null,
      "outcome_status": null,
      "verification": null,
      "error_code": null
    },
    {
      "step_id": "restart",
      "target_server_id": "5e000000-0000-4000-8000-00000000a001",
      "state": "blocked",
      "started_at": "2026-10-11T09:00:05.000Z",
      "finished_at": null,
      "observation": null,
      "operation_id": null,
      "approval_id": null,
      "submission": "not_submitted",
      "outcome_status": null,
      "verification": null,
      "error_code": "revision_conflict"
    },
    {
      "step_id": "after",
      "target_server_id": "5e000000-0000-4000-8000-00000000a001",
      "state": "pending",
      "started_at": null,
      "finished_at": null,
      "observation": null,
      "operation_id": null,
      "approval_id": null,
      "submission": null,
      "outcome_status": null,
      "verification": null,
      "error_code": null
    }
  ],
  "created_at": "2026-10-11T09:00:00.000Z",
  "updated_at": "2026-10-11T09:00:12.000Z"
}
